{"artifacts": {"acceptanceCriteria": ["primary behavior works"], "exclusions": ["unrelated packages"], "paths": [{"path": "openspec/changes/demo-change/tasks.md", "sha256": "aaa"}]}, "budget": {"correctiveRoundsRemaining": 2, "reportSchema": "report.schema.json#1", "timeboxMinutes": 25}, "changeId": "demo-change", "contractVersion": "1", "governance": {"gaps": [], "sources": [{"authority": "declared", "path": "UX_AGENTS.md", "sections": ["Flow principles"], "sha256": "bbb"}]}, "issueId": "LIN-1", "phase": "implement", "reportSchema": "report.schema.json#1", "runId": "demo-1", "skills": {"required": ["implementation"], "selected": [{"name": "implementation", "reason": "task execution", "sha256": "ccc", "source": ".agent-stack/skills/implementation/SKILL.md", "version": "1.0"}]}, "verification": {"authorizedActions": ["create PR"], "plan": ["make test"]}, "worktree": {"allowedScope": ["pkg/a"], "baseRef": "main", "baseSha": "abcdef0", "branch": "lin-1-demo", "repositoryId": "acme/web", "root": "/tmp/wt"}}
